{
  "$schema": "https://json-schema.org/draft/2020-12/schema",
  "title": "RPG Vertical Slice Mission",
  "type": "object",
  "required": [
    "id",
    "title"
  ],
  "properties": {
    "id": {
      "type": "string"
    },
    "title": {
      "type": "string"
    },
    "issuer": {
      "type": "string"
    },
    "station": {
      "type": "string"
    },
    "prerequisites": {
      "type": "array",
      "items": {
        "type": "string"
      }
    },
    "objectives": {
      "type": "array"
    },
    "choice": {
      "type": "object"
    },
    "follow_up": {
      "type": "string"
    }
  }
}