{
  "id": "msr15_02_registry_report",
  "title": "Registry Report",
  "issuer": "dispatcher_tidari",
  "station": "solaris",
  "prerequisites": [
    "knowledge.route_irregularity_observed"
  ],
  "choice": {
    "id": "route_report_choice",
    "options": [
      {
        "id": "report",
        "label_key": "choice.report",
        "effects": [
          "consequence.reported_route_amendment"
        ]
      },
      {
        "id": "withhold",
        "label_key": "choice.withhold",
        "effects": [
          "consequence.withheld_route_amendment"
        ]
      }
    ]
  },
  "follow_up": "msr15_03_ferrum_anomaly"
}